{
  "schema_version": "p4.trace.v1",
  "trace_id": "t2.network_recovery.delayed_failure_backoff",
  "source": {"fw_marker": "boot_trace_host_t2_contract", "environment": "replay"},
  "sanitized": true,
  "events": [
    {"seq": 1, "t_ms": 0, "type": "Boot.Ready"},
    {"seq": 2, "t_ms": 100, "type": "Network.Disconnected"},
    {"seq": 3, "t_ms": 200, "type": "Fault.Inject", "payload": {"action": "delay_next", "target_type": "Network.ReconnectResult", "delay_ms": 300}},
    {"seq": 4, "t_ms": 1200, "type": "Network.ReconnectResult", "payload": {"success": false}},
    {"seq": 5, "t_ms": 2600, "type": "Network.ReconnectResult", "payload": {"success": false}},
    {"seq": 6, "t_ms": 4700, "type": "Network.ReconnectResult", "payload": {"success": true}}
  ],
  "expected": {
    "effects": [
      {"seq": 1, "type": "UI.ShowStandby", "caused_by_event_seq": 1},
      {"seq": 2, "type": "Wake.Enable", "caused_by_event_seq": 1},
      {"seq": 3, "type": "Network.Offline", "caused_by_event_seq": 2},
      {"seq": 4, "type": "Network.ReconnectAttempt", "caused_by_event_seq": 2},
      {"seq": 5, "type": "Network.ReconnectAttempt", "caused_by_event_seq": 4},
      {"seq": 6, "type": "Network.ReconnectAttempt", "caused_by_event_seq": 5},
      {"seq": 7, "type": "Network.Online", "caused_by_event_seq": 6}
    ],
    "m_plus": [
      {"id": "offline_is_visible", "target": "effect", "type": "Network.Offline", "min_count": 1},
      {"id": "network_eventually_recovers", "target": "effect", "type": "Network.Online", "min_count": 1}
    ],
    "m_minus": [
      {"id": "network_fault_must_not_start_session", "target": "effect", "type": "Session.Begin", "max_count": 0}
    ],
    "invariants": [
      {"id": "offline_precedes_online", "kind": "effect_order", "before_type": "Network.Offline", "after_type": "Network.Online"},
      {"id": "three_attempts_cover_initial_and_backoff", "kind": "count", "target": "effect", "type": "Network.ReconnectAttempt", "min_count": 3, "max_count": 3},
      {"id": "online_caused_by_success_result", "kind": "cause_type", "effect_type": "Network.Online", "event_type": "Network.ReconnectResult"}
    ]
  }
}
