{
  "schema_version": "p4.trace.v1",
  "trace_id": "t2.exit_session.delayed_exit_request",
  "source": {"fw_marker": "boot_trace_host_t2_contract", "environment": "replay"},
  "sanitized": true,
  "events": [
    {"seq": 1, "t_ms": 0, "type": "Boot.Ready"},
    {"seq": 2, "t_ms": 100, "type": "Wake.Detected"},
    {"seq": 3, "t_ms": 300, "type": "TTS.Start"},
    {"seq": 4, "t_ms": 400, "type": "TTS.Chunk", "payload": {"chunk_index": 0}},
    {"seq": 5, "t_ms": 700, "type": "TTS.End"},
    {"seq": 6, "t_ms": 900, "type": "Fault.Inject", "payload": {"action": "delay_next", "target_type": "Session.ExitRequested", "delay_ms": 25}},
    {"seq": 7, "t_ms": 1000, "type": "Session.ExitRequested"}
  ],
  "expected": {
    "effects": [
      {"seq": 1, "type": "UI.ShowStandby", "caused_by_event_seq": 1},
      {"seq": 2, "type": "Wake.Enable", "caused_by_event_seq": 1},
      {"seq": 3, "type": "Wake.Disable", "caused_by_event_seq": 2},
      {"seq": 4, "type": "Session.Begin", "caused_by_event_seq": 2},
      {"seq": 5, "type": "Audio.OpenUplink", "caused_by_event_seq": 2},
      {"seq": 6, "type": "UI.ShowListening", "caused_by_event_seq": 2},
      {"seq": 7, "type": "Audio.StartPlayback", "caused_by_event_seq": 3, "payload": {"generation": 1}},
      {"seq": 8, "type": "Visual.SpeechBegin", "caused_by_event_seq": 3, "payload": {"generation": 1}},
      {"seq": 9, "type": "Audio.QueueChunk", "caused_by_event_seq": 4, "payload": {"chunk_index": 0, "generation": 1}},
      {"seq": 10, "type": "Audio.StopPlayback", "caused_by_event_seq": 5, "payload": {"generation": 1}},
      {"seq": 11, "type": "Visual.SpeechEnd", "caused_by_event_seq": 5, "payload": {"generation": 1}},
      {"seq": 12, "type": "UI.ShowListening", "caused_by_event_seq": 5},
      {"seq": 13, "type": "Session.CloseRequest", "caused_by_event_seq": 7},
      {"seq": 14, "type": "Session.Closed", "caused_by_event_seq": 7},
      {"seq": 15, "type": "Wake.Enable", "caused_by_event_seq": 7},
      {"seq": 16, "type": "UI.ShowStandby", "caused_by_event_seq": 7}
    ],
    "m_plus": [
      {"id": "session_close_completes", "target": "effect", "type": "Session.Closed", "min_count": 1},
      {"id": "wake_rearmed_after_close", "target": "effect", "type": "Wake.Enable", "min_count": 2}
    ],
    "m_minus": [
      {"id": "close_must_not_abort", "target": "effect", "type": "Session.CloseAborted", "max_count": 0}
    ],
    "invariants": [
      {"id": "close_request_precedes_closed", "kind": "effect_order", "before_type": "Session.CloseRequest", "after_type": "Session.Closed"},
      {"id": "closed_keeps_exit_cause", "kind": "cause_type", "effect_type": "Session.Closed", "event_type": "Session.ExitRequested"},
      {"id": "single_close_request", "kind": "count", "target": "effect", "type": "Session.CloseRequest", "min_count": 1, "max_count": 1}
    ]
  }
}
