{
  "schema_version": "p4.trace.v1",
  "trace_id": "s1gc-long-tts-minimal",
  "source": {"fw_marker": "boot_trace_v10_s1gc_g3", "environment": "replay", "captured_at": "2026-08-24T10:00:00+08:00"},
  "sanitized": true,
  "events": [
    {"seq": 0, "t_ms": 0, "type": "Wake.Detected"},
    {"seq": 1, "t_ms": 120, "type": "Session.Listening"},
    {"seq": 2, "t_ms": 820, "type": "Tts.Started", "payload": {"generation": 7}},
    {"seq": 3, "t_ms": 6120, "type": "Audio.PlaybackQueueLow"},
    {"seq": 4, "t_ms": 12400, "type": "Tts.Ended", "payload": {"generation": 7}}
  ],
  "expected": {
    "effects": [
      {"seq": 0, "type": "Session.Begin", "caused_by_event_seq": 0},
      {"seq": 1, "type": "Audio.OpenUplink", "caused_by_event_seq": 1},
      {"seq": 2, "type": "Audio.PlayTts", "caused_by_event_seq": 2},
      {"seq": 3, "type": "Visual.ReduceMouthBudget", "caused_by_event_seq": 3},
      {"seq": 4, "type": "Visual.CloseMouth", "caused_by_event_seq": 4}
    ],
    "m_plus": [{"id": "tts_audio_is_emitted", "target": "effect", "type": "Audio.PlayTts", "min_count": 1}],
    "m_minus": [{"id": "no_spurious_abort", "target": "effect", "type": "Audio.Abort", "max_count": 0}],
    "invariants": [
      {"id": "session_before_playback", "kind": "effect_order", "before_type": "Session.Begin", "after_type": "Audio.PlayTts"},
      {"id": "one_close_at_end", "kind": "count", "target": "effect", "type": "Visual.CloseMouth", "min_count": 1, "max_count": 1},
      {"id": "close_caused_by_end", "kind": "cause_type", "effect_type": "Visual.CloseMouth", "event_type": "Tts.Ended"}
    ]
  }
}
