{
  "schema_version": "p4.trace.v1",
  "trace_id": "t2.same_emotion_cross_generation.duplicate_safe_point",
  "source": {"fw_marker": "boot_trace_host_t2_contract", "environment": "replay"},
  "sanitized": true,
  "events": [
    {"seq": 1, "t_ms": 0, "type": "Boot.Ready"},
    {"seq": 2, "t_ms": 100, "type": "Wake.Detected"},
    {"seq": 3, "t_ms": 200, "type": "TTS.Start"},
    {"seq": 4, "t_ms": 220, "type": "Emotion.Requested", "payload": {"emotion": "happy"}},
    {"seq": 5, "t_ms": 230, "type": "Visual.SafePoint"},
    {"seq": 6, "t_ms": 240, "type": "Fault.Inject", "payload": {"action": "duplicate_next", "target_type": "Emotion.Requested"}},
    {"seq": 7, "t_ms": 250, "type": "Emotion.Requested", "payload": {"emotion": "happy"}},
    {"seq": 8, "t_ms": 260, "type": "Visual.SafePoint"},
    {"seq": 9, "t_ms": 300, "type": "TTS.Chunk", "payload": {"chunk_index": 0}},
    {"seq": 10, "t_ms": 500, "type": "TTS.End"},
    {"seq": 11, "t_ms": 800, "type": "TTS.Start"},
    {"seq": 12, "t_ms": 820, "type": "Emotion.Requested", "payload": {"emotion": "happy"}},
    {"seq": 13, "t_ms": 840, "type": "Visual.SafePoint"},
    {"seq": 14, "t_ms": 1000, "type": "TTS.End"}
  ],
  "expected": {
    "effects": [
      {"seq": 1, "type": "UI.ShowStandby", "caused_by_event_seq": 1},
      {"seq": 2, "type": "Wake.Enable", "caused_by_event_seq": 1},
      {"seq": 3, "type": "Wake.Disable", "caused_by_event_seq": 2},
      {"seq": 4, "type": "Session.Begin", "caused_by_event_seq": 2},
      {"seq": 5, "type": "Audio.OpenUplink", "caused_by_event_seq": 2},
      {"seq": 6, "type": "UI.ShowListening", "caused_by_event_seq": 2},
      {"seq": 7, "type": "Audio.StartPlayback", "caused_by_event_seq": 3, "payload": {"generation": 1}},
      {"seq": 8, "type": "Visual.SpeechBegin", "caused_by_event_seq": 3, "payload": {"generation": 1}},
      {"seq": 9, "type": "Emotion.Pending", "caused_by_event_seq": 4, "payload": {"emotion": "happy", "generation": 1}},
      {"seq": 10, "type": "Emotion.Commit", "caused_by_event_seq": 5, "payload": {"emotion": "happy", "generation": 1}},
      {"seq": 11, "type": "Emotion.Pending", "caused_by_event_seq": 7, "payload": {"emotion": "happy", "generation": 1}},
      {"seq": 12, "type": "Emotion.Pending", "caused_by_event_seq": 7, "payload": {"emotion": "happy", "generation": 1}},
      {"seq": 13, "type": "Emotion.Deduplicated", "caused_by_event_seq": 8, "payload": {"emotion": "happy", "generation": 1}},
      {"seq": 14, "type": "Audio.QueueChunk", "caused_by_event_seq": 9, "payload": {"chunk_index": 0, "generation": 1}},
      {"seq": 15, "type": "Audio.StopPlayback", "caused_by_event_seq": 10, "payload": {"generation": 1}},
      {"seq": 16, "type": "Visual.SpeechEnd", "caused_by_event_seq": 10, "payload": {"generation": 1}},
      {"seq": 17, "type": "UI.ShowListening", "caused_by_event_seq": 10},
      {"seq": 18, "type": "Audio.StartPlayback", "caused_by_event_seq": 11, "payload": {"generation": 2}},
      {"seq": 19, "type": "Visual.SpeechBegin", "caused_by_event_seq": 11, "payload": {"generation": 2}},
      {"seq": 20, "type": "Emotion.Pending", "caused_by_event_seq": 12, "payload": {"emotion": "happy", "generation": 2}},
      {"seq": 21, "type": "Emotion.Commit", "caused_by_event_seq": 13, "payload": {"emotion": "happy", "generation": 2}},
      {"seq": 22, "type": "Audio.StopPlayback", "caused_by_event_seq": 14, "payload": {"generation": 2}},
      {"seq": 23, "type": "Visual.SpeechEnd", "caused_by_event_seq": 14, "payload": {"generation": 2}},
      {"seq": 24, "type": "UI.ShowListening", "caused_by_event_seq": 14}
    ],
    "m_plus": [
      {"id": "same_emotion_commits_in_both_generations", "target": "effect", "type": "Emotion.Commit", "min_count": 2},
      {"id": "same_generation_duplicate_is_suppressed", "target": "effect", "type": "Emotion.Deduplicated", "min_count": 1}
    ],
    "m_minus": [
      {"id": "cross_generation_must_not_be_deduplicated", "target": "effect", "type": "Emotion.CrossGenerationDeduplicated", "max_count": 0}
    ],
    "invariants": [
      {"id": "exactly_two_emotion_commits", "kind": "count", "target": "effect", "type": "Emotion.Commit", "min_count": 2, "max_count": 2},
      {"id": "commits_only_at_safe_points", "kind": "cause_type", "effect_type": "Emotion.Commit", "event_type": "Visual.SafePoint"},
      {"id": "pending_precedes_commit", "kind": "effect_order", "before_type": "Emotion.Pending", "after_type": "Emotion.Commit"}
    ]
  }
}
